{
  "$schema": "http://json-schema.org/draft-07/schema#",
  "$id": "https://barter.internal/ai-system-sync/package.schema.json",
  "title": "AI System Sync package manifest (claude-project.sync.json)",
  "description": "Hand-authored mapping and naming-decision contract for one registered system's derived claude.ai Project package. lib/manifest.cjs enforces this shape at runtime with a hand-rolled validator (the fleet is dependency-free, so no JSON Schema engine is installed); this file is the documented reference the validator is written against, not an executable schema.",
  "type": "object",
  "additionalProperties": false,
  "required": [
    "schemaVersion",
    "id",
    "skillRoot",
    "skillId",
    "knowledgeRoot",
    "kernel",
    "sourceCoverage",
    "mirrors",
    "contractInputs",
    "expectedKnowledgeCount"
  ],
  "properties": {
    "schemaVersion": {
      "const": 1,
      "description": "Manifest schema version. Starts at 1 per the design authority."
    },
    "id": {
      "type": "string",
      "minLength": 1,
      "description": "Must match one registry.json system id exactly."
    },
    "skillRoot": {
      "type": "string",
      "minLength": 1,
      "description": "Current sk-* folder name, repo-root-relative. Must match registry.json's skillRoot for this id."
    },
    "skillId": {
      "type": "string",
      "minLength": 1,
      "description": "Stable invocation or graph identity for this skill (e.g. the description.json \"name\" or graph-metadata.json \"skill_id\"), used by the graph-target and retired-token checks."
    },
    "knowledgeRoot": {
      "const": "claude project/knowledge",
      "description": "Fixed location of the Project Knowledge mirror folder, package-root-relative."
    },
    "kernel": {
      "type": "object",
      "additionalProperties": false,
      "required": ["path", "version", "alignedSkillVersion"],
      "properties": {
        "path": {
          "const": "claude project/Custom Instructions.md",
          "description": "Fixed location of the hand-synthesized kernel, package-root-relative."
        },
        "version": {
          "type": "string",
          "minLength": 1,
          "description": "Human-selected Project kernel version (e.g. \"1.3.0\")."
        },
        "alignedSkillVersion": {
          "type": "string",
          "minLength": 1,
          "description": "Human-selected claim of which sk-* skill version this kernel is aligned to."
        }
      }
    },
    "sourceCoverage": {
      "type": "object",
      "additionalProperties": false,
      "required": ["include"],
      "properties": {
        "include": {
          "type": "array",
          "minItems": 1,
          "items": { "type": "string", "minLength": 1 },
          "description": "Authoritative source paths (package-root-relative), each either a file or a folder covering every file recursively beneath it - there is no glob syntax, naming a folder is how \"cover everything in it\" is expressed. Every file covered here must be mapped by an entry in \"mirrors\", or the run blocks as UNMAPPED_SOURCE."
        },
        "exclude": {
          "type": "array",
          "items": { "type": "string", "minLength": 1 },
          "description": "Changelogs, archives, benchmarks, or other intentional coverage omissions."
        }
      }
    },
    "mirrors": {
      "type": "array",
      "minItems": 1,
      "items": {
        "type": "object",
        "additionalProperties": false,
        "required": ["source", "target", "sourceVersion", "projectVersion"],
        "properties": {
          "source": {
            "type": "string",
            "minLength": 1,
            "description": "Authoritative source path, package-root-relative (e.g. \"sk-product-owner/SKILL.md\")."
          },
          "target": {
            "type": "string",
            "minLength": 1,
            "description": "Exact Project Knowledge filename this source mirrors to, inside knowledgeRoot. Never derived from frontmatter or version text - always an explicit human naming decision."
          },
          "sourceVersion": {
            "type": "string",
            "description": "Version pin as it exists in the authoritative source."
          },
          "projectVersion": {
            "type": "string",
            "description": "Version pin as it appears in the mirror's filename/frontmatter."
          }
        }
      }
    },
    "contractInputs": {
      "type": "array",
      "minItems": 1,
      "items": { "type": "string", "minLength": 1 },
      "description": "Package-root-relative paths whose combined bytes make up the ai-system-contract-v1 digest. A change to any of these requires a recorded review-kernel decision."
    },
    "validators": {
      "type": "array",
      "items": {
        "type": "object",
        "additionalProperties": false,
        "required": ["name", "command", "cwd"],
        "properties": {
          "name": { "type": "string", "minLength": 1 },
          "command": {
            "type": "array",
            "minItems": 1,
            "items": { "type": "string" },
            "description": "Argument vector, e.g. [\"python3\", \"benchmark/_gates/gates.py\", \"check\"]. Never a shell string, so no shell-quoting ambiguity."
          },
          "cwd": {
            "type": "string",
            "minLength": 1,
            "description": "Package-root-relative directory to run the command from."
          }
        }
      }
    },
    "retiredNames": {
      "type": "array",
      "items": { "type": "string", "minLength": 1 },
      "description": "Old folder, mirror, or version tokens forbidden outside declared history (scanExcludes)."
    },
    "scanExcludes": {
      "type": "array",
      "items": { "type": "string", "minLength": 1 },
      "description": "Historical changelog/archive paths (package-root-relative) exempt from the retired-token scan."
    },
    "expectedKnowledgeCount": {
      "type": "integer",
      "minimum": 0,
      "description": "Must equal the number of declared mirror entries."
    },
    "derivationExceptions": {
      "type": "array",
      "items": {
        "type": "object",
        "additionalProperties": false,
        "required": ["path", "reason"],
        "properties": {
          "path": {
            "type": "string",
            "minLength": 1,
            "description": "The mirror target path (knowledgeRoot-relative) or kernel path this exception applies to."
          },
          "reason": {
            "type": "string",
            "minLength": 1,
            "description": "Documented reason the byte-parity check is waived for this path (e.g. link retargeting plus frontmatter addition)."
          }
        }
      },
      "description": "Declared, reviewed exceptions to the plain byte-copy mirror rule. Every other mirror not listed here must be byte-identical to its dereferenced source."
    },
    "generatedRegions": {
      "type": "array",
      "items": {
        "type": "object",
        "additionalProperties": false,
        "required": ["target", "sections"],
        "properties": {
          "target": {
            "type": "string",
            "minLength": 1,
            "description": "Package-root-relative file containing the generated region(s), e.g. \"SYNC.md\" or \"claude project/README.md\"."
          },
          "sections": {
            "type": "array",
            "minItems": 1,
            "items": { "type": "string", "minLength": 1 },
            "description": "Section names used in that file's BEGIN/END markers."
          }
        }
      }
    }
  }
}
